{
  "materialId": "11111111-1111-4111-8111-111111111111",
  "materialVersionId": "22222222-2222-4222-8222-222222222222",
  "assets": [
    {
      "type": "opinion",
      "title": "AI 节省执行时间，不一定节省总时间",
      "statement": "AI 可能减少直接执行时间，却增加需求表达、检查与返工成本。",
      "context": "来自一次真实工作复盘，结论只适用于需要人工验收的知识工作。",
      "audiences": [
        "产品经理",
        "内容创作者"
      ],
      "confidence": 0.93,
      "privacyLevel": "public_usable",
      "personalExperienceStatus": "explicit",
      "requiresUserConfirmation": false,
      "suggestedTags": [
        "效率",
        "验证成本"
      ],
      "sources": [
        {
          "chunkId": "33333333-3333-4333-8333-333333333333",
          "startOffset": 0,
          "endOffset": 31,
          "startMs": 0,
          "endMs": 18000,
          "excerpt": "执行时间减少了，但验证和返工时间增加了。",
          "supportType": "direct"
        }
      ]
    }
  ],
  "processingNotes": [
    "未抽取具体时间数据，因为原素材没有提供。"
  ]
}
